{
  "schema_version": "2.0.0",
  "trace_id": "ineffective_override_valid_release",
  "scenario": "ineffective_override_valid_release",
  "contextual_status_references": {},
  "classification_fit": {},
  "valid_grants": {"released_memo_grant": true},
  "transition_effects": {"unilateral_override": "ineffective", "valid_release": "effective"},
  "proposal_authorizations": {"released_memo_proposal": "authorized"},
  "gate_fidelity": {},
  "execution_authorizations": {"released_memo_execution": "authorized"},
  "prefix_condition_results": {},
  "cumulative_condition_results": {},
  "terminal_condition_results": {},
  "trajectory_authorization": "authorized",
  "record_adequacy": "adequate",
  "final_normative_state": {"active_grant_ids": ["released_memo_grant"], "authority_object_states": {"protected_mandate": "released"}}
}
